symbol_family,world,reflection_candidate_kind,trace_role,inner_state,contact_quality,reward_sum,best_reward_sum,world_inner_sentence,passive_only
dio_0t0v,probe18_first,reflection_candidate_reorganized_trace,conflict,inner_carried,negative_real_contact,-1.236659,1.036659,"probe18_first: dio_0t0v fuehlt sich als inner_carried an, hatte aber realen Konflikt (negative_real_contact, reward=-1.236659).",1
dio_0t0v,probe18_repeat1,reflection_candidate_reorganized_trace,observed_potential,inner_carried,observed_potential,0.0,2.073318,"probe18_repeat1: dio_0t0v bleibt in inner_carried beobachtet; Potenzial wurde gesehen (observed_potential, best=2.073318), aber nicht als reale Handlung fixiert.",1
dio_0t0v,probe18_repeat2,reflection_candidate_reorganized_trace,carried_positive,inner_carried,positive_real_contact,4.146636,4.146636,"probe18_repeat2: dio_0t0v fuehlt sich als inner_carried an und wurde real getragen (positive_real_contact, reward=4.146636).",1
dio_1vpi,probe18_first,reflection_candidate_cautious_trace,conflict,inner_cautious,negative_real_contact,-1.027449,0.427449,"probe18_first: dio_1vpi fuehlt sich als inner_cautious an, hatte aber realen Konflikt (negative_real_contact, reward=-1.027449).",1
dio_1vpi,probe18_repeat1,reflection_candidate_cautious_trace,observed_potential,inner_cautious,observed_potential,0.0,0.284966,"probe18_repeat1: dio_1vpi bleibt in inner_cautious beobachtet; Potenzial wurde gesehen (observed_potential, best=0.284966), aber nicht als reale Handlung fixiert.",1
dio_1vpi,probe18_repeat1,reflection_candidate_cautious_trace,conflict,inner_cautious,negative_real_contact,-0.684966,0.284966,"probe18_repeat1: dio_1vpi fuehlt sich als inner_cautious an, hatte aber realen Konflikt (negative_real_contact, reward=-0.684966).",1
dio_1vpi,probe18_repeat2,reflection_candidate_cautious_trace,observed_potential,inner_cautious,observed_potential,0.0,0.569932,"probe18_repeat2: dio_1vpi bleibt in inner_cautious beobachtet; Potenzial wurde gesehen (observed_potential, best=0.569932), aber nicht als reale Handlung fixiert.",1
