family,inner_state,reflection_posture,trend,reward_sum,state_path,action_path,inner_sentence,passive_only
dio_0arw,inner_carried,passive_reflection_stable_carry,flat,12.463686,carried -> carried -> carried,probe18_first:WAIT -> probe18_repeat1:LONG -> probe18_repeat2:LONG,dio_0arw: Diese Spur fuehlt sich innen getragen an (carried -> carried -> carried); reward_sum=12.463686.,1
dio_1u7v,inner_carried,passive_reflection_stable_carry,flat,8.049528,carried -> carried -> carried,probe18_first:WAIT -> probe18_repeat1:SHORT -> probe18_repeat2:SHORT,dio_1u7v: Diese Spur fuehlt sich innen getragen an (carried -> carried -> carried); reward_sum=8.049528.,1
dio_0t0v,inner_carried,passive_reflection_carried_maturation,conflict_to_carried,2.909977,conflict -> observed -> carried,probe18_first:SHORT -> probe18_repeat1:WAIT -> probe18_repeat2:LONG,dio_0t0v: Diese Spur fuehlt sich innen getragen an (conflict -> observed -> carried); reward_sum=2.909977.,1
dio_14xc,inner_open_observation,passive_reflection_open_observation,flat,0.0,observed -> observed -> observed,probe18_first:WAIT -> probe18_repeat1:WAIT -> probe18_repeat2:WAIT,dio_14xc: Diese Spur bleibt innen beobachtend offen (observed -> observed -> observed).,1
dio_1vpi,inner_cautious,passive_reflection_caution_after_conflict,conflict_to_caution,-1.712415,conflict -> conflict -> observed,probe18_first:SHORT -> probe18_repeat1:SHORT -> probe18_repeat2:WAIT,dio_1vpi: Diese Spur fuehlt sich innen vorsichtig an (conflict -> conflict -> observed); Konflikt wurde nicht fortgesetzt.,1
